{
  "$schema": "../../schemas/conformance-cases.schema.json",
  "schemaVersion": 1,
  "standardId": "edge-canon.next",
  "suiteId": "EC-ENV",
  "status": "draft",
  "executionModel": "provider-independent-oracle",
  "cases": [
    {
      "id": "EC-ENV-T001", "title": "declaration 与 snapshot 精确绑定唯一应用入口", "kind": "normal",
      "clauseIds": ["EC-ENV-API-001", "EC-ENV-API-002", "EC-ENV-API-006"],
      "fixture": {"scenario": "以精确标准版本构造 declaration、snapshot 与两个 deployment/environment identity", "requirements": ["canonical declaration", "version-bound snapshot", "context.env materializer"]},
      "oracle": {"observations": ["declaration digest", "snapshot identities", "context keys", "provider extras"], "assertions": ["snapshot 引用精确 declaration", "只暴露声明名称", "不出现 provider 原生对象"]}
    },
    {
      "id": "EC-ENV-T002", "title": "string、JSON、secret 与 required/optional 语义精确", "kind": "normal",
      "clauseIds": ["EC-ENV-API-003", "EC-ENV-API-004"],
      "fixture": {"scenario": "绑定 config string、config JSON、secret string 并省略 optional binding", "requirements": ["three supported binding forms", "secret revision store", "optional declaration"]},
      "oracle": {"observations": ["runtime types", "value digests", "optional own-property"], "assertions": ["三种值按声明类型注入", "optional 缺失不成为属性", "secret/json 被拒绝"]}
    },
    {
      "id": "EC-ENV-T003", "title": "每次 invocation 深冻结且 Node projection 受限", "kind": "security",
      "clauseIds": ["EC-ENV-API-005", "EC-ENV-SEC-005"],
      "fixture": {"scenario": "并发 materialize 两次后尝试改写 env、嵌套 JSON 与 process compatibility projection", "requirements": ["nested JSON", "two invocations", "host/provider canaries"]},
      "oracle": {"observations": ["prototype", "freeze depth", "cross-invocation value", "process keys"], "assertions": ["env 为 null prototype 且递归冻结", "invocation 不共享可写引用", "process 只投影 string config"]}
    },
    {
      "id": "EC-ENV-T004", "title": "文档、名称、重复与 identity 错误在派生前拒绝", "kind": "failure",
      "clauseIds": ["EC-ENV-ERR-001"],
      "fixture": {"scenario": "注入未知字段、无效名称、重复名称、浮动版本与 declaration digest 漂移", "requirements": ["document mutation matrix", "provider derivation counter", "diagnostic sentinel"]},
      "oracle": {"observations": ["stable codes", "derivation count", "diagnostic leakage"], "assertions": ["所有变体 fail closed", "没有 provider 派生", "诊断不含 sentinel 或宿主路径"]}
    },
    {
      "id": "EC-ENV-T005", "title": "activation 缺失、类型和 revision 故障全有或全无", "kind": "failure",
      "clauseIds": ["EC-ENV-ERR-002", "EC-ENV-ERR-003", "EC-ENV-FAIL-002"],
      "fixture": {"scenario": "分别移除 required、增加未声明 binding、改变 kind/type 并丢失 secret revision", "requirements": ["active old snapshot", "invalid staging variants", "handler counter"]},
      "oracle": {"observations": ["failure codes", "active identity", "handler count", "partial key count"], "assertions": ["失败均发生于切换前", "旧 snapshot 保持", "handler 未执行且没有部分 env"]}
    },
    {
      "id": "EC-ENV-T006", "title": "并发 activation 只观察完整 old/new snapshot", "kind": "boundary",
      "clauseIds": ["EC-ENV-CON-001", "EC-ENV-CON-002", "EC-ENV-CON-003"],
      "fixture": {"scenario": "64 个并发 invocation 与两个 expected-current activation 竞争", "requirements": ["atomic selector", "paired binding sentinels", "activation audit order"]},
      "oracle": {"observations": ["observed pairs", "mixed count", "winning activation", "retry state"], "assertions": ["每次只见 old/old 或 new/new", "一个竞争者成功", "相同 snapshot digest 确定"]}
    },
    {
      "id": "EC-ENV-T007", "title": "build/runtime 分离且变更只影响新 deployment", "kind": "upgrade",
      "clauseIds": ["EC-ENV-LIFE-001", "EC-ENV-LIFE-002"],
      "fixture": {"scenario": "保持同一 application artifact，轮换 config 后在 in-flight 与新 invocation 比较", "requirements": ["stable artifact identity", "old and new snapshots", "in-flight barrier"]},
      "oracle": {"observations": ["artifact identity", "old/new values", "in-flight value"], "assertions": ["runtime value 不改变 artifact", "新 invocation 才见新 snapshot", "build variable 不自动注入"]}
    },
    {
      "id": "EC-ENV-T008", "title": "删除、retention、rotation 与 rollback 使用精确 revision", "kind": "upgrade",
      "clauseIds": ["EC-ENV-LIFE-003", "EC-ENV-LIFE-004", "EC-ENV-UPG-003"],
      "fixture": {"scenario": "创建两次 secret rotation，回滚旧 revision，再模拟销毁后回滚", "requirements": ["immutable secret revisions", "reference inventory", "rollback selector"]},
      "oracle": {"observations": ["revision identities", "retention decisions", "rollback value digest", "destroyed rollback code"], "assertions": ["rotation 不覆盖 revision", "被引用 revision 不提前销毁", "销毁后回滚保持当前"]}
    },
    {
      "id": "EC-ENV-T009", "title": "64 bindings 与 5120 UTF-8 bytes 边界可验证", "kind": "boundary",
      "clauseIds": ["EC-ENV-LIMIT-001", "EC-ENV-LIMIT-002"],
      "fixture": {"scenario": "执行 63/64/65 binding 和 5119/5120/5121 byte string、secret、canonical JSON", "requirements": ["UTF-8 multibyte values", "canonical JSON counter", "pre-upload validation"]},
      "oracle": {"observations": ["accepted boundaries", "failure codes", "upload count"], "assertions": ["64 与 5120 被接受", "65 与 5121 稳定拒绝", "加密开销不计入 value bytes"]}
    },
    {
      "id": "EC-ENV-T010", "title": "secret 不回显、不落产物且跨租户隔离", "kind": "security",
      "clauseIds": ["EC-ENV-SEC-001", "EC-ENV-SEC-002", "EC-ENV-SEC-003", "EC-ENV-SEC-004", "EC-ENV-FAIL-003"],
      "fixture": {"scenario": "向两个 tenant 写入同名 secret，扫描成功/失败/取消的 artifact、cache、log、audit、argv 与 evidence", "requirements": ["secret sentinel", "management read", "two tenant vault namespaces"]},
      "oracle": {"observations": ["metadata keys", "sentinel counts", "tenant value digests", "namespace collision codes"], "assertions": ["管理读取无 value", "所有持久/输出面 sentinel 为零", "tenant 隔离且资源重名拒绝"]}
    },
    {
      "id": "EC-ENV-T011", "title": "prepare/activate/cleanup 故障保持当前并可重试", "kind": "failure",
      "clauseIds": ["EC-ENV-FAIL-001"],
      "fixture": {"scenario": "在 secret write、materialize、selector switch 与 cleanup 注入故障", "requirements": ["operation journal", "staging revision inventory", "cleanup retry"]},
      "oracle": {"observations": ["active identity", "operation state", "staging references", "cleanup identity"], "assertions": ["任何失败不移动当前 selector", "无引用 staging 被清除或留下可重试 identity", "没有成功假象"]}
    },
    {
      "id": "EC-ENV-T012", "title": "未知版本先拒绝且迁移只生成新 identity", "kind": "upgrade",
      "clauseIds": ["EC-ENV-UPG-001", "EC-ENV-UPG-002"],
      "fixture": {"scenario": "注入 v2、浮动标准和未知字段，再对 immutable v1 declaration/snapshot 执行迁移", "requirements": ["version mutation set", "secret read counter", "read-only migration source"]},
      "oracle": {"observations": ["failure codes", "secret reads", "source/migrated identities", "behavior diff"], "assertions": ["版本错误在 secret read 前失败", "迁移不改源且 identity 改变", "行为差异显式记录"]}
    }
  ]
}
